,links,title,text
34,https://russian.rt.com/article/310372-the-washington-post-voennoe-sotrudnichestvo-rossii-i,The Washington Post: Военное сотрудничество России и США в Сирии будет усиливаться,"Администрация президента США Барака Обамы предложила российским властям новое соглашение по Сирии, сообщает The Washington Post. В соответствии с документом военное сотрудничество между странами в борьбе с террористами должно усилиться. Взамен Вашингтон якобы потребовал от России усилить взаимодействие с властями Сирии.

По данным газеты, США пообещали объединить усилия с ВКС России для совместных, более масштабных, бомбардировок группировки «Фронт ан-Нусра»*. Об этом автору статьи в The Washington Post Джошу Рогину сообщил представитель администрации Обамы. Текст соглашения был передан российским властям 27 июня, после нескольких недель переговоров и обсуждений внутри администрации американского президента. Соглашение было лично одобрено президентом Обамой и получило активную поддержку Джона Керри, который также рассчитывает на новый уровень сотрудничества американских и российских войск. Изложение материала публикует ИноТВ.



В обмен, пишет Рогин, США предлагают России уговорить Асада на прекращение бомбардировок тех групп оппозиционеров, которых США не считают террористами. Вашингтон не выдаст Москве конкретное месторасположение этих групп, но укажет определённые зоны, которые нельзя будет бомбить. Министр обороны США Эштон Картер выступил против этого плана, но его уговорили согласиться, сообщает The Washington Post.



Как утверждает Джош Рогин, новый план Белого дома на самом деле может ухудшить положение повстанцев. От борьбы с «Фронтом ан-Нусра» выиграет Асад, другие же группы повстанцев, сражающихся с режимом, окажутся в проигрышном положении. «Если США и Россия ополчатся против «Фронта ан-Нусра», изменится ход борьбы в Алеппо и Идлибе. Это определённо на руку режиму Асада, а также, возможно, курдам и ИГ*», — приводит издание слова Эндрю Тэблера из вашингтонского Института по ближневосточной политике.



Пресс-секретарь Госдепа Джон Кирби отказался комментировать детали этого соглашения, но выступил в защиту его основных принципов. Для Белого дома приоритет в Сирии — не завершение гражданской войны и даже не отставка Асада.

Администрацию Обамы можно понять, пишет журналист: в последние месяцы своего существования она пытается креативно подойти к своей политике в Сирии. Однако предложение, которое Обама сделал Путину, дорого обойдётся США и негативно скажется на их позициях в сирийском кризисе. И эту цену придется платить ещё долго после того, как Обама покинет свой пост, делает вывод журналист The Washington Post.



*ИГ и «Фронт ан-Нусра» — террористические организации, деятельность которых в России запрещена.



"
35,https://russian.rt.com/article/310320-vladimir-putin-ishod-borby-s-islamskim-gosudarstvom,Владимир Путин: Исход борьбы с «Исламским государством» решается в Сирии,"Президент России Владимир Путин заявил, что исход борьбы с международной террористической организацией «Исламское государство»* решается в Сирии. При этом, по его словам, в мире растёт конфликтный потенциал, а террористы пользуются попытками насаждения демократии в некоторых регионах. Кроме того, глава государства рассказал о планах наладить двусторонние отношения с Турцией и прокомментировал «обвинения» в адрес России по поводу результатов референдума о членстве Великобритании в ЕС.

Исход войны с «Исламским государством» сейчас решается в Сирии. Об этом заявил российский президент Владимир Путин на совещании послов и постпредов РФ.

«В эпицентре борьбы с терроризмом оказалась Сирия. Не будет преувеличением сказать, что от судьбы этой страны во многом зависит не только будущее Ближневосточного региона. На сирийской земле решается исход борьбы с этим самым ИГИЛ, под знамёнами которого собрались террористы и экстремисты всех мастей, объединённые стремлением к экспансии на весь исламский мир», — сказал Путин.

Он отметил, что до окончательного урегулирования кризиса ещё очень далеко, однако накопленный за последние месяцы в Сирии опыт наглядно показал, что противостоять угрозам можно только объединяя усилия.

Кроме того, глава государства подчеркнул, что террористы на Ближнем Востоке и севере Африки не без успеха пытаются воспользоваться неуклюжими попытками насаждения демократии на территории региона.

Конкуренция за ресурсы

При этом, по словам Владимира Путина, в мире усиливается конкуренция за влияние и ресурсы. «Положение дел в мире далеко от стабильного и становится всё менее предсказуемым. Серьёзные изменения претерпевают все сферы международных отношений», — сказал он, добавив, что растёт и конфликтный потенциал.

«Убеждён: избежать опасных срывов, неконтролируемого развития ситуации можно только на основе диалога и взаимодействия», — отметил Путин.

Он также подчеркнул, что РФ «никому не навязывает ни свою волю, ни свои ценности».

«Россия проводит эффективную и самостоятельную внешнюю политику, стремится выстраивать открытое и честное взаимодействие со всеми государствами: и на западе, и на востоке, и на юге, и на севере. Выступает за развитие взаимовыгодных, конструктивных связей в самых разных областях», — сказал президент, добавив, что Москва твёрдо следует нормам международного права.

Сотрудничество с США

Путин отметил, что Россия заинтересована развивать сотрудничество с Вашингтоном.

«Мы заинтересованы в плотном взаимодействии с Соединёнными Штатами в международных делах, но, безусловно, не приемлем подхода в той части американского истеблишмента, которые считают, что они сами решают, в каких вопросах с нами сотрудничать, а в каких — наращивать на нас различного рода нажимы, в том числе санкционные. Мы за равноправное партнёрство с учётом интересов друг друга. Только на такой базе и будем работать», — сказал Путин.

НАТО

Также Владимир Путин заявил, что действия НАТО у границ России подрывают существующий военный паритет. «Нас постоянно обвиняют в том, что мы осуществляем какую-то военную активность. Где? На своей территории. А то, что у наших границ развивается, это «нормально», — сказал он.

Президент отметил, что в Польше и Прибалтике размещаются силы быстрого реагирования, пополняются арсеналы наступательных вооружений. «Всё это направлено на подрыв десятилетиями складывавшегося военного паритета», — добавил глава государства.

По его словам, Россия намерена и дальше адекватно реагировать на вызовы, однако «не собирается поддаваться милитаристскому угару, к которому её стараются подтолкнуть».

Монополия западных СМИ

Нельзя пропускать враньё в отношении России и допускать фальсификацию истории страны, также сказал глава государства.

«Надо энергично противостоять информационной монополии западных медиа, в том числе поддерживать всеми доступными методами российские средства массовой информации, работающие за рубежом, — заявил он. — И естественно, нельзя просто пропускать враньё в отношении России и фальсификацию истории».

По его мнению, Россия должна нарастить усилия по противодействию информационным атакам, в мире развязана борьба за влияние на общественное мнение.

«Наши дипломаты, конечно, понимают, насколько важна сегодня борьба за влияние на общественные настроения, на общественное мнение. В последние годы мы много занимаемся этими вопросами, однако в условиях настоящей информационной атаки, подчас развязанной некоторыми нашими так называемыми партнёрами против нашей страны, встаёт задача ещё более нарастить усилия на данном направлении», — сказал Путин.

Брексит

Комментируя высказывания некоторых западных политиков и СМИ, президент заявил, что Россия не вмешивалась и никак не будет вмешиваться в процесс по выходу Великобритании из ЕС.

«Это выбор подданных Великобритании, и мы никак в этот процесс не вмешивались и не вмешиваемся», — подчеркнул Путин.

* «Исламское государство» — террористическая группировка, запрещённая в РФ."
36,https://russian.rt.com/article/310123-turciya-v-paches-prinimayutsya-vse-mery-chtoby,"Турция в ПАЧЭС: Принимаются все меры, чтобы не допустить боевиков из Сирии","Глава турецкой делегации Парламентской ассамблеи Черноморского экономического сотрудничества (ПАЧЭС) Рамазан Джан заявил, что Турция принимает все меры, чтобы не допустить боевиков со стороны Сирии.

«В настоящее время в Сирии разворачивается война, и в таких условиях случается, что артиллерийские снаряды также попадают на территорию Турции со стороны Сирии. Конечно, мы стараемся укрепить наши границы для защиты своих граждан. Мы сотрудничаем с различными странами в борьбе с ИГИЛ и другими террористическими организациями, и мы предпринимаем все необходимые усилия для того, чтобы не допустить перехода боевиков этих организаций через границу с Сирией», — приводит РИА Новости комментарий Джана, сделанный на 47-й Генассамблее ПАЧЭС."
