,links,title,text
0,https://russian.rt.com/article/314644-gorod-na-ruinah-aleppo-do-i-posle,Город на руинах: Алеппо до и после атак террористов,"После атак террористов группировки «Исламское государство»* в сирийском Алеппо город полностью поменял своё лицо. От улиц, домов и мечетей практически ничего не осталось. RT публикует фотографии Алеппо до и после военных действий.

Алеппо — это второй по величине город Сирии, важнейший экономический и геополитический центр страны. Его освобождение может стать ключом к разрешению сирийского конфликта.

Кроме того, Алеппо — один из сирийских городов, который больше остальных пострадал во время войны. До XIX века он был частью Великого шёлкового пути, поэтому его исторический центр отличался особым убранством.

Портал Olimpia.gr сделал подборку фотографий разных исторических частей города до и после атак.

Напомним, Минобороны России совместно с правительством Сирии приступило к масштабной гуманитарной операции по оказанию помощи в Алеппо. Власти САР распространяют среди местных жителей листовки со схемой безопасного выхода из города и инструкцией.

Специальный посланник ООН по Сирии Стаффан де Мистура заявил, что организация внимательно изучила данные о гумоперации России и Сирии в Алеппо, и высказался за необходимость ввести 48-часовую гуманитарную паузу.

«Алеппо имеет первостепенное значение для всех участников конфликта, поскольку это важнейший экономический торговый центр, город, который находится на пересечении торговых путей, занимает выдающееся геополитическое положение. Контроль над Алеппо позволяет контролировать не только весь север Сирии, но и территорию, пограничную с Турцией, район проживания курдов и территорию северо-западного Ирака. Это доминирующий центр данного региона. И для правительственных войск, и для их противников, и для Турции, Саудовской Аравии, США контроль над Алеппо — это ключ к контролю над территорией Сирии и близлежащих регионов», — заявил ранее в интервью RT директор Института политики, права и социального развития МГГУ им. М.А. Шолохова Владимир Шаповалов.

Эксперты утверждают, что взятие Алеппо должно ознаменовать собой конец войны в САР. «Освобождение Алеппо фактически означает освобождение Сирии», — сказал в интервью RT политолог Маис Курбанов.

* «Исламское государство» (ИГ) — запрещённая в России террористическая организация."
1,https://russian.rt.com/article/314427-perelomnyi-moment-kak-vzyatie-aleppo-mozhet-povliyat,Переломный момент: как взятие Алеппо может повлиять на разрешение сирийского конфликта,"Алеппо в кольце. Разгром засевших в городе и отчаянно сопротивляющихся боевиков, похоже, дело времени. Но о штурме пока речь не идёт. Чтобы минимизировать потери среди мирного населения, российские военные и сирийское правительство проводят гуманитарную операцию и призывают экстремистов сложить оружие. О положении на фронтах и стратегическом значении Алеппо — в материале RT.

Ключ к миру

Значение Алеппо трудно переоценить. Это второй по величине город Сирии, важнейший экономический и геополитический центр страны. Его взятие может стать ключом к разрешению сирийского конфликта.

«Алеппо имеет первостепенное значение для всех участников конфликта, поскольку это важнейший экономический торговый центр, город, который находится на пересечении торговых путей, занимает выдающееся геополитическое положение, — сказал в интервью RT директор Института политики, права и социального развития МГГУ им. Шолохова Владимир Шаповалов. — Контроль над Алеппо позволяет контролировать не только весь север Сирии, но и территорию, пограничную с Турцией, район проживания курдов, и территорию Северо-Западного Ирака. Это доминирующий центр данного региона. И для правительственных войск, и для их противников, и для Турции, Саудовской Аравии, США контроль над Алеппо — это ключ к контролю над территорией Сирии и близлежащих регионов».

Неудивительно, что за город ведутся столь ожесточённые бои, причём с самого начала гражданской войны.

«Это важнейший стратегический пункт, экономическая столица Сирии, — отметил в интервью RT директор Центра изучения стран Ближнего Востока и Центральной Азии Семён Багдасаров. — Зачистка Алеппо была бы грандиозной победой нашей коалиции».

Остановить кровопролитие

Однако правительственные войска не спешат форсировать ситуацию. Сирийская армия и ополченцы завершили окружение Алеппо. Боевики оказались отрезаны от всех путей снабжения. Тем самым правительственные силы создали плацдарм для наступления и взятия Алеппо, а также обеспечили себе возможность передышки. И сейчас для руководства Сирии главная задача — разрешить конфликт малой кровью.

С соответствующим призывом к населению и боевикам обратились сирийские военные: «Для того чтобы остановить кровопролитие, мы даём всем людям, носящим оружие в окрестностях восточного Алеппо, реальный шанс урегулировать конфликт, сдав оружие, и остаться в Алеппо. Или для тех, кто желает, — сдать оружие и покинуть город. Мы приглашаем всех, взываем к здравому смыслу и предлагаем соблюсти национальные интересы для восстановления безопасности и стабильности в Алеппо».

Чтобы минимизировать потери среди населения и оказать помощь горожанам, российские военные и сирийское правительство проводят гуманитарную операцию. Мирным жителям и желающим сдаться боевикам будут предоставлены коридоры, по которым они смогут покинуть Алеппо.

Важность этой операции на данном этапе ведения боевых действий сложно переоценить. «Алеппо — это город, в котором живут сотни тысяч человек. И в данной ситуации главное — спасение жизней жителей и обеспечение их продуктами и медикаментами», — заявил в интервью RT Владимир Шаповалов.

Расклад сил

Что же происходит сейчас в Алеппо? Дислокация противоборствующих сторон довольно пёстрая. «Центр города, историческая часть, находится в руках правительственных сил и отрядов самообороны, — обрисовал ситуацию Семён Багдасаров. — Расположение их противников представляет собой чересполосицу различных группировок боевиков. В основном это боевики «Джебхат ан-Нусра»*. На севере — ИГ**. Курды контролируют два квартала. Также в городе есть отряды «Хезболлы».

Однако взять город будет не так просто. Во-первых, необходимо объединить и скоординировать усилия осаждающих. А во-вторых — решить проблему переходов на сирийско-турецкой границе, через которые может поступать помощь боевикам.

«Взятие Алеппо без перекрытия переходов на сирийско-турецкой границе, в первую очередь перехода Азаза, — очень трудная задача, — сказал Багдасаров. — Азаза — это ворота в Турцию. Через этот переход были переброшены масса материальных грузов, боеприпасов, вооружений и тысячи боевиков. Закрывать его надо, и сделать это можно только в союзе с тем квазигосударством, которое создано на северо-востоке, Федерацией Северной Сирии, или иначе — сирийскими курдами».

Курдский вопрос

При зачистке Алеппо территория, которую контролируют сирийские курды, будет играть очень важную роль. «Дело в том, что на этой территории находятся свыше 2 тыс. военнослужащих НАТО, — отметил Семён Багдасаров. — Одна половина — американские войска спецназначения и инженерно-сапёрные части, другая — войска Дании, Великобритании, Франции и Германии. Там чёткой границы не очерчено. В ходе мероприятий могут столкнуться две силы».

Следует учитывать, что курды более других заинтересованы в ликвидации боевиков и могут стать серьёзным союзником Асада. «Для курдов важнейший вопрос — борьба с исламскими боевиками, которые на данный момент являются основными противниками курдов в создании ими автономии, — подчеркнул Владимир Шаповалов. — В этом контексте для курдов важен союз с правительством Сирии, потому что именно Асад может обеспечить безопасность курдских районов — не только от исламских террористов, но и от притязаний со стороны Турции».

Третья сила

Немаловажную роль в урегулировании конфликта или его эскалации могут сыграть Соединённые Штаты.

«США и их партнёры могут призвать боевиков сложить оружие и во избежание кровопролития покинуть город», — сказал Шаповалов. Весь вопрос в том, насколько США в этом заинтересованы. Следует учесть, что из четырёх крупных террористических группировок, действующих в Сирии, две поддерживаются Вашингтоном. С их помощью американцы всё ещё надеются сбросить Асада.

Свои виды на Алеппо имеет и Турция. «Турция вообще претендует на северо-запад Сирии, в том числе на Алеппо. Для Турции это лакомый кусок, — констатировал Багдасаров. — Турки исторически считают Алеппо своим городом. Считают, что там население наиболее тяготеет к Турции. Но это не так».

Взгляд в будущее

Эксперты в один голос утверждают, что взятие Алеппо — это конец войны. «Освобождение Алеппо фактически означает освобождение Сирии», — сказал в интервью RT политолог Маис Курбанов.

«Освобождение Алеппо будет иметь грандиозное значение, — подчеркнул Семён Багдасаров. — Возможно, некоторые группировки сложат оружие».

Взятие Алеппо также будет иметь колоссальное значение и для восстановления мирной жизни в Сирии.

«Контроль над Алеппо позволит завершить процесс восстановления власти сирийского правительства над большей частью территории Сирии, над самой густонаселённой частью, самой экономически развитой частью Сирии, — заявил Владимир Шаповалов. — После установления контроля над Алеппо вопрос о контроле над оставшейся частью Сирии будет вопросом нескольких недель».

Илья Оганджанов

* «Джебхат ан-Нусра» («Фронт ан-Нусра») — запрещённая в России террористическая организация.

** «Исламское государство» (ИГ) — запрещённая в России террористическая организация."
2,https://russian.rt.com/article/314401-eksperty-specsluzhb-rasskazali-o-shemah-borby-s,Эксперты спецслужб рассказали о схемах борьбы с международным терроризмом,"В Санкт-Петербурге завершилось 15-е совещание руководителей спецслужб органов безопасности и правоохранительных органов иностранных государств-партнёров ФСБ РФ. Эксперты, выступавшие на мероприятии, отметили необходимость консолидации общих усилий и рассказали о достигнутых успехах в борьбе с международным терроризмом.

«ИГ* и «Аль-Каида»* — террористические группы, против которых борются спецслужбы со всего мира. Международное сотрудничество на разных уровнях абсолютно необходимо. У террористов нет врагов или друзей. Все, кто не с ними, по их мнению и определению против них», – рассказал руководитель мониторинговой группы при Совете Безопасности ООН по проблематике «Исламского государства», «Аль-Каиды» и «Талибана»* Ханс-Якоб Шиндлер.

По его словам, в последнее время участились случаи присоединения иностранцев к международным террористическим группировкам. В связи с этим были созданы мониторинговые комиссии, которые отслеживают подобные случаи.

«Мы создали мониторинговые группы в Сирии и Ираке, которые отслеживают таких бойцов и возвращают их домой», – отметил он.

Успехи в работе по борьбе с терроризмом отметил и директор Региональной антитеррористической структуры ШОС Евгений Сысоев.

«Мы состоялись организационно, состоялись профессионально, состоялись как эффективная и перспективная международная антитеррористическая структура, которая получает позитивные оценки со стороны Совета глав государств ШОС», – перечислил он основные достижения структуры.

Евгений Сысоев отметил, что за последние годы сложились не только единые подходы к противодействию терроризму, но и сформировалось взаимное доверие и уважение при сотрудничестве спецслужб.

«В основе нашей совместной работы лежит обмен информацией о деятельности иностранных боевиков-террористов. У нас есть совместные базы данных», – подчеркнул Сысоев.

О подобной работе непосредственно в Европе рассказал и советник координатора по борьбе с терроризмом ЕС Гюнтер Заблатниг.

«В настоящее время наша работа сосредоточена на Северной Африке, Сирии, Ираке. Мы также стараемся усилить, активизировать работу внутри Евросоюза в области обмена информации и сбора необходимых данных. Много усилий прилагается по каналам европейского полицейского объединения Европола. Мы также активно ведём сотрудничество на международном уровне, через каналы Интерпола и в двустороннем формате, в том числе и с Российской Федерацией», – подчеркнул он.

По словам представителя ЕС, планируется создать специальную сеть, где будет собираться информация по предупреждению террористических актов. Она объединит специалистов из разных областей.

Заблатниг отметил, что в настоящее время большой проблемой является радикализация людей через социальные сети. Для разрешения этой ситуации было создано спецподразделение, которое ведёт работу в этом направлении, взаимодействуя с руководителями соцсетей.

«Если обнаруживается какой-то негативный контент, например, видеозаписи, фотографии обезглавливания, каких-то жестоких действий террористов, то подразделение Европола передаёт эту информацию в соответствующие структуры, которые отвечают за социальные сети, и предлагает им убрать её», – объяснил работу структуры советник.

Проблему радикализации населения отметил и советник директора Агентства безопасности и информации Сербии Драган Симеунович.

«Мы знаем, что 19% (мигрантов в Сербии. — RT) — молодые люди, большинство которых принимали участие в гражданских войнах в Ираке, Сирии и Афганистане. В связи с этим можно утверждать, что все они держали оружие в своих руках и имеют некоторый опыт. Поэтому если они начнут радикализироваться, а это сейчас очень быстрый процесс особенно из-за соцсетей, то станут опасны», – пояснил он.

Симеунович также отметил, что значительную роль в стимулировании потока мигрантов в Европу сыграли США.

* «Исламское государство» (ИГ), «Аль-Каида» и «Талибан» — террористические организации, запрещённые в России."
