,links,title,text
54,https://russian.rt.com/article/304834-genshtab-rf-ezhednevno-v-siriyu-idyot-potok,Генштаб РФ: Ежедневный поток оружия из Турции сирийским террористам не прекращается,"Начальник Главного оперативного управления Генштаба Вооружённых сил РФ Сергей Рудской провёл брифинг для журналистов. Генерал-лейтенант сообщил, что из Турции в Сирию ежедневно идёт поток грузовиков с оружием, предназначенным для боевиков «Фронта ан-Нусра».

Россия, выполняя взятые на себя обязательства, продолжает работу по мирному урегулированию сирийского конфликта. Об этом на брифинге для журналистов заявил начальник Главного оперативного управления Генштаба РФ генерал-лейтенант Сергей Рудской.

«В целом обстановка на территории Сирии существенно улучшилась, — отметил он. — Сократилось количество обстрелов, в районах, где полностью прекращены боевые действия, возвращается мирная жизнь. Населению оказывается гуманитарная помощь, восстанавливается разрушенная войной инфраструктура. Растёт число населённых пунктов, подписавших соглашения о примирении. На сегодняшний день их число увеличилось до 120».

Основным очагом напряжённости и активных боевых действий являются районы Сирии, где бесчинствуют близкие к «Аль-Каиде» формирования международной террористической группировки «Фронт ан-Нусра», подчеркнул генерал-лейтенант.

Благодаря работе российских ВКС было уничтожено более 200 объектов нефтедобычи, перекачки и переработки топлива, а также свыше 2 тыс. средств доставки нефтепродуктов для контрабандной продажи в Турцию.

Вместе с тем Рудской отметил: «Не прекращается поток большегрузных автомобилей из Турции с оружием и боеприпасами, ежедневно пересекающих турецко-сирийскую границу».

Кроме того, продолжаются обстрелы турецкой артиллерией сирийских приграничных населённых пунктов и позиций курдского ополчения.

В Генштабе РФ заявили, что 20 мая российская сторона предложила американской продолжить работу с формированиями «умеренной» оппозиции по присоединению к режиму прекращения боевых действий, а также призвала совместно наносить удары ВКС России и авиации коалиции, возглавляемой США, по отрядам террористической организации «Фронт ан-Нусра» и примкнувших к ней группировок.

«Ответ, полученный от Соединённых Штатов, несмотря на положительные оценки принимаемых нами мер, не предусматривает совместных действий против террористических организаций, что ведёт к дальнейшей эскалации военного конфликта», — обратил внимание Рудской.

Несмотря на достигнутые Россией и США договорённости, до настоящего времени не согласован вопрос разграничения зон, контролируемых отрядами «умеренной» оппозиции, и территорий, занимаемых боевиками «Фронта ан-Нусра», что не позволяет эффективно вести борьбу с этой террористической организацией, заключил генерал-лейтенант."
55,https://russian.rt.com/article/304643-v-minoborony-rf-podderzhali-prisvoenie-statusa-veterana,В Минобороны РФ поддержали присвоение статуса ветерана гражданским специалистам в Сирии,"Статс-секретарь — заместитель министра обороны РФ Николай Панков заявил, что в ведомстве поддерживают идею присвоения статуса ветерана гражданским специалистам, принимавшим участие в российской операции в Сирии.

«Осознавая роль гражданских специалистов (в военной операции России в Сирии. — RT) <…>, мы выступаем за предоставление им статуса ветеранов боевых действий, как это сейчас предусмотрено федеральным законом «О ветеранах» (в отношении гражданских служащих — ветеранов войны в Афганистане. — RT)», — цитирует РИА Новости Панкова."
56,https://russian.rt.com/article/304442-britanskii-mid-usmotrel-v-politike-moskvy-ugrozu,Британский МИД усмотрел в политике Москвы угрозу собственной безопасности,"Глава МИД Великобритании Филип Хэммонд заявил, что Россия угрожает сложившейся системе безопасности в Европе. Дипломат раскритиковал стратегию Москвы в отношении Сирии и Украины, назвав её целью сломить решимость европейских стран. Политолог Мартин Макколи объяснил, чем продиктованы такие заявления британских официальных лиц. Подробности — в материале RT.

Министр иностранных дел Великобритании Филип Хэммонд представил парламенту доклад о ключевых проблемах безопасности для Соединённого Королевства. Он назвал Россию угрозой для порядка, сложившегося в Европе после окончания холодной войны.

«Действия Москвы в Сирии и на Украине вызывают у нас серьёзные опасения по поводу сохранения системы безопасности, к которой мы привыкли за 25 лет. Цель российской стратегии — сломить решимость Европы. Это напрямую угрожает стабильности порядка, сложившегося в Европе после окончания холодной войны», — заявил Хэммонд.

Кроме того, Россию обвинили в том, что она не оказывает достаточного давления на сирийского президента Башара Асада, который, как считает Великобритания, должен покинуть пост. Британский политолог Мартин Макколи объяснил, почему Лондон и Москва по-разному представляют себе политическое будущее Сирии.

«Великобритании сложившаяся ситуация явно не по душе: Лондон ждёт, что Москва окажет давление на Башара Асада и заставит его пойти на уступки. А Россия, в свою очередь, заявляет, что ничем Асаду не обязана и вмешалась в происходящее в Сирии не для того, чтобы его защищать. Москве хотелось бы, чтобы во главе Сирии стоял светский лидер и власть не захватили джихадисты, но сирийский народ должен сам определить свою судьбу», — отметил Макколи."
57,https://russian.rt.com/article/304389-ssha-ne-otkazhutsya-ot-uhoda-bashara-asada,Госдеп: США не откажутся от ухода Башара Асада даже в обмен на мир в Сирии,"Госдеп США подтвердил, что основной целью США в Сирии является отстранение президента Башара Асада от власти. В ответ на вопрос журналистов, готовы ли США отказаться от этой цели в обмен на мир в Сирии, официальный представитель Госдепа Марк Тонер ответил отрицательно. Он также заявил, что включение группировки «Ахрар аш-Шам» в список террористических организаций может негативно повлиять на возможность сохранения перемирия в Сирии.

На традиционном брифинге Госдепа США журналисты обратились к официальному представителю ведомства Марку Тонеру с просьбой рассказать о приоритетах внешней политики США. Как выяснилось, в списке первоочередных задач американской дипломатии установление мира в Сирии находится строчкой ниже, после смещения президента Башара Асада.

На первом месте в числе приоритетов США в Сирии представитель Госдепа назвал победу над ИГ и лишь на втором — прекращение войны в Сирии. Тем не менее в ходе дальнейшего обсуждения выяснилось, что победа над ИГ никак не устроит Соединённые Штаты, если она будет одержана силами официального правительства.

Марк Тонер отметил, что успехи правительственных войск в борьбе с ИГ не слишком радуют США.

«Я не буду ликовать по поводу освобождения такого города, как Пальмира, режимом, осуществлявшим последние пять лет невероятное насилие в отношении своих граждан», — заявил Тонер.

Один из журналистов поднял вопрос о возможности прекращения войны в Сирии путём передачи под контроль Башара Асада тех регионов Сирии, на которые в настоящий момент не распространяется власть Дамаска.

«Некоторые из бывших помощников президента Обамы, в том числе Фил Гордон, публично заявляют, что лучшим вариантом может быть просто признание того факта, что Асад останется у власти. Он сможет поставить под контроль те регионы страны, которые сегодня не находятся под его влиянием. И это положит конец гражданской войне — именно его вы называете своей второй целью в Сирии. Готовы ли вы рассмотреть вопрос о возможности пребывания у власти Асада, если это прекратит кровопролитие?» — обратился к дипломату журналист.

Марк Тонер отверг такой вариант развития событий, подтвердив, что США не рассматривали и не будут рассматривать возможность сохранения властных полномочий в руках Башара Асада.

«Нашей позицией и позицией Международной группы поддержки Сирии (МПГС) всегда было сохранение целостности и суверенитета Сирии внутри её сегодняшних границ. Мы также не верим, что Асад может быть частью будущего Сирии, учитывая, что он совершил», — заявил Тонер. Тонер отметил, что США допускают возможность мирных переговоров исключительно между Асадом и оппозицией.

В ходе брифинга был также поднят вопрос о группировке «Ахрар аш-Шам», совершившей ряд преступлений в отношении мирного населения. В частности, ранее были представлены доказательства её причастности к резне в сирийской деревне аз-Зара на юге провинции Хомс, которая была организована её боевиками совместно с «Фронтом ан-Нусра».

Ранее госдепартамент США отказывался комментировать любую информацию, связанную с действиями «Ахрар аш-Шам» в Сирии. Несмотря на представленные доказательства её причастности к убийствам мирного населения, США заблокировали предложение РФ в Совбезе ООН о признании «Ахрар аш-Шам» террористической организацией.

Тонер сообщил, что внесение «Ахрар аш-Шам» в лист террористических организаций пошло бы во вред мирному процессу в Сирии.

«Россия пыталась этого добиться. А наш ответ заключается в том, что, по нашему мнению, такого рода мера на данном этапе пошла бы во вред режиму прекращения боевых действий, а также всему политическому процессу в Сирии», — заявил Тонер.

Дипломат отметил, что группировка была допущена к участию в Высшем комитете по переговорам сирийской оппозиции и США надеются на то, что они примут условия перемирия."
58,https://russian.rt.com/article/304257-ukrainskii-sait-mirotvorec-opublikoval-eschyo-odin-spisok,Украинский сайт «Миротворец» опубликовал ещё один список иностранных журналистов,"Сайт «Миротворец», оказавшийся в центре скандала в связи с публикацией личных данных журналистов, обнародовал новый список сотрудников СМИ. На этот раз в него попали, по мнению администрации сайта, сотрудничающие с Россией журналисты, включая корреспондентов известных изданий из США, Турции, Франции и Великобритании.

Скандальный украинский сайт «Миротворец», поддерживаемый советником главы МВД Украины Антоном Геращенко, опубликовал новый список личных данных журналистов, которые якобы сотрудничают с Россией.

В перечень вошли 293 человека, включая сотрудников таких крупных СМИ, как телеканалы BBC, Sky News, Al Arabiya, агентства Reuters, «Синьхуа», УНИАН, AFP, издания The Daily Telegraph, The Times, The Guardian, Der Spiegel, DW, Newsweek, The Washington Post, Hürriyet, радио «Свобода» и другие.

На сайте опубликованы адреса иностранных журналистов на территории РФ, а также номера их телефонов и телефонов корпунктов.

Ранее в список «Миротворца» попали журналисты RT Роман Косарев и Мигель Сантьяго. По мнению Косарева, владельцы сайта пытаются заставить и без того не отличавшиеся объективностью в вопросе Украины западные СМИ ещё реже посещать Донбасс для освещения конфликта.

«Сайт «Миротворец», по сути, выполнил одну из задач. Теперь иностранные СМИ, ранее не отличавшиеся мегаобъективностью, ещё меньше захотят ездить в Донбасс для освещения конфликта и будут черпать информацию из официальных источников, которые преуспели в креативности по отношению к войне на востоке страны», — отметил корреспондент RT.

По словам Косарева, пока «Миротворец» собирает и публикует данные журналистов, на Украине продолжается братоубийственная война. «Поддерживается эта война в том числе и из-за искусственно созданного информационного вакуума. Главная цель людей, стоящих за так называемым «Миротворцем», — запугать журналистов до такой степени, что все будут отказываться от подобных командировок», — подчеркнул он.

«Мне очень жаль, что у меня навсегда отобрали возможность осветить конфликт на Украине с другой стороны, но я рад, что такой шанс был у украинских СМИ и они им воспользовались. Кстати, они тоже были аккредитованы в Донецке, и я надеюсь, с ними ничего не произойдёт за то, что сумели прорвать информационную блокаду и донести до своего зрителя лучик правды, увиденной собственными глазами», — добавил Косарев.

Кроме того, журналист отметил, что не раз призывал указывать на фактические ошибки в своих сюжетах, однако данная просьба осталась без ответа.

Всего в новый список вошли 293 человека. Это представители Австрии, Азербайджана, Алжира, Аргентины, Армении, Белоруссии, Болгарии, Бразилии, Великобритании, Венгрии, Вьетнама, Германии, Греции, Грузии, Дании, Египта, Израиля, Индии, Ирака, Исландии, Испании, Италии, Казахстана, Канады, Катара, Киргизии, Кипра, Китая, Кореи, Кубы, Кувейта, Латвии, Ливана, Марокко, Мексики, Монголии, Нидерландов, Норвегии, ОАЭ, Пакистана, Польши, Португалии, Румынии, Сербии, Сирии, Словении, США, Таджикистана, Турции, Узбекистана, Украины, Финляндии, Франции, Чехии, Швейцарии, Швеции, Эстонии, Японии, а также сотрудники межарабских СМИ.

Реакция мирового сообщества

Ранее работники СМИ обратились к международной общественности с открытым письмом, в котором подчеркнули недопустимость обнародования персональных данных. Публикацию подобной информации осудили в МИД РФ, Евросоюзе, ОБСЕ и Госдепе США.

После этого «Миротворец» объявил о своём закрытии, однако уже через неделю советник главы МВД Украины Антон Геращенко сообщил о возобновлении работы сайта.

Кроме того, советник председателя Службы безопасности Украины Юрий Тандит заявил, что не исключает привлечения к ответственности представителей СМИ, попавших в список «Миротворца».

Убийства

В 2015 году в Киеве были убиты две видные фигуры — всего через несколько дней после того, как их личную информацию опубликовали на сайте «Миротворец».

Один из убитых — журналист-оппозиционер Олесь Бузина. После убийства его профиль был удалён. Представители сайта утверждают, что страницы Бузины там никогда и не было, а приведённый скриншот — фальшивка. Однако профиль журналиста легко найти в кэш-памяти Google.

Второй убитый — Олег Калашников, бывший народный депутат Украины от Партии регионов. Он был застрелен на пороге своей квартиры в Киеве."
